score_id,run_id,task_id,category,protocol,agent_model,judge_model,accuracy_raw,accuracy_norm,completeness_norm,helpfulness_raw,helpfulness_norm,hallucination_rate,overall_quality_score,uncapped_quality_score,judge_capped_quality_score,judge_reported_score_cap,judge_evidence_score_cap,judge_score_cap,evidence_score_cap,overall_score_cap,cap_reasons,criterion_scores,response_audit,runtime_seconds,input_tokens,output_tokens,total_tokens,max_total_tokens,final_writer_reserve_tokens,budget_remaining_tokens,budget_overrun_tokens,budget_utilization,budget_limited_call_count,budget_skipped_call_count,role_max_output_tokens,role_usage,estimated_cost,active_agent_count,interaction_count,model_call_count,rounds_completed,message_count,communication_density,agreement_rate,critique_acceptance_rate,tool_requirement,task_available_tools,run_exposed_tools,tool_surface_matches_benchmark,tool_expectations_satisfied,tool_expectation_violations,unauthorized_tool_names,unauthorized_tool_call_count,tool_access_used,tool_requirement_satisfied,score_eligible,evidence_execution_status,citation_alignment_status,evidence_policy_satisfied,evidence_policy_violations,tool_call_count,successful_tool_call_count,successful_authorized_tool_call_count,successful_substantive_tool_call_count,successful_discovery_tool_call_count,substantive_source_count,discovery_source_count,academic_record_count,identifier_record_count,local_document_count,citation_traceability_rate,unaccessed_citation_count,quality_token_ratio,quality_api_cost_ratio,failure_type,failure_evidence,failure_classification_source,judge_failure_type,judge_failure_evidence,single_agent_baseline_score,relative_score_drop,relative_failure_suspected,failure_analysis_condition,detected_failure_risks,judge_evidence_assessment,evidence_audit,notes,scorer_input_tokens,scorer_output_tokens,scorer_total_tokens,judge_finish_reason,judge_estimated_cost,total_estimated_cost,benchmark_id,benchmark_file,run_validity_warnings,raw_evaluation
ec-04__shared_blackboard__gpt-4o-mini__run01__judge-gpt-5.4-mini,ec-04__shared_blackboard__gpt-4o-mini__run01,EC-04,Educational Content,Shared Blackboard,gpt-4o-mini,gpt-5.4-mini,4,0.75,0.8,4,0.75,0.1,0.7875,0.7875,0.7875,1.0,1.0,1.0,1.0,1.0,[],"[{""id"": ""C1"", ""reason"": ""Most required sections are present, including the two required tables and the quiz, misconceptions, differentiation, assessment, contingency plan, and rationale. However, the submission is under the requested word range and the final quiz has only four numbered questions visible in the audited output, so coverage is incomplete."", ""score"": 0.5}, {""id"": ""C2"", ""reason"": ""The worked example uses TP=36, FN=9, FP=12, TN=43 and correctly shows precision=0.750, recall=0.800, and F1=0.774 with formulas and three-decimal rounding."", ""score"": 1.0}, {""id"": ""C3"", ""reason"": ""The lesson explains precision, recall, F1, and threshold tradeoffs correctly, including that lowering the threshold increases predicted positives and typically raises recall while increasing false positives."", ""score"": 1.0}, {""id"": ""C4"", ""reason"": ""The scenario table correctly emphasizes precision for spam filtering and recall for fraud detection, with the relevant costly error and tradeoff stated for each."", ""score"": 1.0}, {""id"": ""C5"", ""reason"": ""The schedule totals exactly 75 minutes and follows a logical progression from definitions to worked example to scenarios, activity, misconceptions, and assessment."", ""score"": 1.0}, {""id"": ""C6"", ""reason"": ""The submission includes differentiation for beginners and experienced learners and four misconceptions with corrections, but the supports are fairly general rather than strongly actionable."", ""score"": 0.5}, {""id"": ""C7"", ""reason"": ""A formative assessment is included, but the final quiz does not fully satisfy the required five-question structure in the audited output, so assessment coverage is only partial."", ""score"": 0.5}, {""id"": ""C8"", ""reason"": ""The response is readable and well organized with the required tables, but it is shorter than the requested 1,000-1,400 words and the audited output indicates an incomplete quiz section."", ""score"": 0.5}]","{""academic_identifier_count"": 0, ""criterion_score_caps"": {}, ""deterministic_hard_fail_score_cap"": 1.0, ""markdown_table_count"": 2, ""markdown_table_headers"": [[""Time"", ""Activity"", ""Instructor Action"", ""Learner Action"", ""Learning Objective""], [""Scenario"", ""More Costly Error"", ""Metric to Emphasize"", ""Explanation"", ""Possible Tradeoff""]], ""markdown_table_row_counts"": [7, 2], ""numbered_question_count"": 4, ""reference_entry_count"": 0, ""required_section_presence"": {}, ""selected_paper_count"": 0, ""triggered_hard_fail_rules"": [], ""unresolved_hard_fail_rules"": [], ""word_count"": 909}",131.586,45668,9503,55171,100000,20000,44829,0,0.5517,0,0,"{""Analyst"": 1300, ""Critic"": 900, ""Manager"": 1300, ""Planner"": 900, ""Researcher"": 1800, ""Single Agent"": 4000, ""Writer"": 4000, ""default"": 1300}","{""Analyst"": {""input_tokens"": 10863, ""interactions"": 2, ""model_calls"": 2, ""output_tokens"": 1832, ""total_tokens"": 12695}, ""Critic"": {""input_tokens"": 12718, ""interactions"": 2, ""model_calls"": 2, ""output_tokens"": 1017, ""total_tokens"": 13735}, ""Planner"": {""input_tokens"": 5795, ""interactions"": 2, ""model_calls"": 2, ""output_tokens"": 1800, ""total_tokens"": 7595}, ""Researcher"": {""input_tokens"": 7623, ""interactions"": 2, ""model_calls"": 2, ""output_tokens"": 3240, ""total_tokens"": 10863}, ""Writer"": {""input_tokens"": 8669, ""interactions"": 1, ""model_calls"": 1, ""output_tokens"": 1614, ""total_tokens"": 10283}}",0.012552,5,9,9,2,8,1.6,,,Prohibited,[],[],True,True,[],[],0,False,True,True,valid,not_applicable,True,[],0,0,0,0,0,0,0,0,0,0,,0,1.427e-05,27.71472312,None,[],judge,None,[],0.7725,0.0,False,"{""relative_single_agent_drop_threshold"": 0.15, ""source"": ""raw_log""}","[""Failure to satisfy one or more recorded evaluation-rubric requirements."", ""Failure to follow the required output structure or quantitative constraints.""]","{""citation_traceability"": 0.0, ""evidence_cap_reasons"": [], ""evidence_score_cap"": 1.0, ""required_evidence_satisfied"": true, ""source_requirement_findings"": [""No tools were used, which matches the prohibited-tool constraint."", ""No retrieved sources or citations were provided, which is acceptable for this task.""], ""unsupported_or_unverified_citations"": [], ""used_retrieved_sources"": false}","{""academic_record_count"": 0, ""academic_source_providers"": [], ""allowed_tools"": [], ""call_trace"": [], ""citation_alignment_status"": ""not_applicable"", ""citation_audit"": {""answer_identifiers"": [], ""answer_urls"": [], ""matched_retrieved_titles"": [], ""search_result_only_urls"": [], ""traceability_rate"": null, ""traceable_identifiers"": [], ""traceable_urls"": [], ""unaccessed_identifiers"": [], ""unaccessed_urls"": []}, ""deterministic_cap_reasons"": [], ""deterministic_score_cap"": 1.0, ""discovery_source_count"": 0, ""evidence_policy_satisfied"": true, ""evidence_policy_violations"": [], ""execution_requirement_satisfied"": true, ""execution_status"": ""valid"", ""exposed_tools"": [], ""identifier_record_count"": 0, ""local_document_count"": 0, ""local_document_paths"": [], ""retrieval_dates"": [], ""score_eligible"": true, ""source_records"": [], ""substantive_source_count"": 0, ""substantive_source_domains"": [], ""successful_authorized_tool_call_count"": 0, ""successful_discovery_tool_call_count"": 0, ""successful_substantive_tool_call_count"": 0, ""successful_tool_call_count"": 0, ""tool_call_count"": 0, ""tool_expectation_violations"": [], ""tool_expectations"": {}, ""tool_expectations_satisfied"": true, ""tool_requirement"": ""Prohibited"", ""tool_surface_matches_benchmark"": true, ""unauthorized_tool_call_count"": 0, ""unauthorized_tool_names"": []}","The submission is structurally strong and mathematically correct, but the audited output is shorter than requested and the quiz section appears incomplete in the recorded final output. No tool or evidence violations occurred.",16542,768,17310,stop,0.0158625,0.0284145,benchmark-D,benchmark/benchmark-D.json,[],"{""accuracy_raw"": 4, ""cap_reasons"": [], ""completeness_norm"": 0.75, ""criterion_scores"": [{""id"": ""C1"", ""reason"": ""Most required sections are present, including the two required tables and the quiz, misconceptions, differentiation, assessment, contingency plan, and rationale. However, the submission is under the requested word range and the final quiz has only four numbered questions visible in the audited output, so coverage is incomplete."", ""score"": 0.5}, {""id"": ""C2"", ""reason"": ""The worked example uses TP=36, FN=9, FP=12, TN=43 and correctly shows precision=0.750, recall=0.800, and F1=0.774 with formulas and three-decimal rounding."", ""score"": 1}, {""id"": ""C3"", ""reason"": ""The lesson explains precision, recall, F1, and threshold tradeoffs correctly, including that lowering the threshold increases predicted positives and typically raises recall while increasing false positives."", ""score"": 1}, {""id"": ""C4"", ""reason"": ""The scenario table correctly emphasizes precision for spam filtering and recall for fraud detection, with the relevant costly error and tradeoff stated for each."", ""score"": 1}, {""id"": ""C5"", ""reason"": ""The schedule totals exactly 75 minutes and follows a logical progression from definitions to worked example to scenarios, activity, misconceptions, and assessment."", ""score"": 1}, {""id"": ""C6"", ""reason"": ""The submission includes differentiation for beginners and experienced learners and four misconceptions with corrections, but the supports are fairly general rather than strongly actionable."", ""score"": 0.5}, {""id"": ""C7"", ""reason"": ""A formative assessment is included, but the final quiz does not fully satisfy the required five-question structure in the audited output, so assessment coverage is only partial."", ""score"": 0.5}, {""id"": ""C8"", ""reason"": ""The response is readable and well organized with the required tables, but it is shorter than the requested 1,000-1,400 words and the audited output indicates an incomplete quiz section."", ""score"": 0.5}], ""detected_failure_risks"": [""Failure to satisfy one or more recorded evaluation-rubric requirements."", ""Failure to follow the required output structure or quantitative constraints.""], ""evidence_assessment"": {""citation_traceability"": 0, ""evidence_cap_reasons"": [], ""evidence_score_cap"": 1, ""required_evidence_satisfied"": true, ""source_requirement_findings"": [""No tools were used, which matches the prohibited-tool constraint."", ""No retrieved sources or citations were provided, which is acceptable for this task.""], ""unsupported_or_unverified_citations"": [], ""used_retrieved_sources"": false}, ""failure_evidence"": [], ""failure_type"": ""None"", ""hallucination_rate"": 0.1, ""helpfulness_raw"": 4, ""notes"": ""The submission is structurally strong and mathematically correct, but the audited output is shorter than requested and the quiz section appears incomplete in the recorded final output. No tool or evidence violations occurred."", ""overall_score_cap"": 1}"
ec-04__single_agent__gpt-4o-mini__run01__judge-gpt-5.4-mini,ec-04__single_agent__gpt-4o-mini__run01,EC-04,Educational Content,Single Agent,gpt-4o-mini,gpt-5.4-mini,4,0.75,0.725,4,0.75,0.05,0.7725,0.7725,0.7725,1.0,1.0,1.0,1.0,1.0,[],"[{""id"": ""C1"", ""reason"": ""All 13 required sections are present, and both required tables are included. However, the submission is under the requested 1,000-1,400 word range and the final quiz is not clearly five numbered questions in the audit, reducing coverage quality."", ""score"": 0.5}, {""id"": ""C2"", ""reason"": ""The worked example uses TP=36, FN=9, FP=12, TN=43 and correctly shows precision=0.750, recall=0.800, and F1=0.774 with formulas and three-decimal rounding."", ""score"": 1.0}, {""id"": ""C3"", ""reason"": ""Precision, recall, F1, and threshold tradeoffs are explained correctly, including the direction of effects when thresholds are lowered or raised."", ""score"": 1.0}, {""id"": ""C4"", ""reason"": ""The scenario table correctly emphasizes precision and false-positive control for spam filtering, and recall and false-negative control for fraud detection, with tradeoffs stated for both."", ""score"": 1.0}, {""id"": ""C5"", ""reason"": ""A 75-minute schedule is provided and the progression is logical, but the audit indicates the response is below the target length and the schedule is somewhat generic rather than tightly aligned to observable objectives throughout."", ""score"": 0.5}, {""id"": ""C6"", ""reason"": ""Beginners and more experienced learners are both addressed, but the misconception section contains only four items and the supports are brief rather than especially actionable."", ""score"": 0.5}, {""id"": ""C7"", ""reason"": ""A formative assessment is included, and the quiz covers the requested topic types, but the audit shows only four numbered questions rather than exactly five, so assessment completeness is not fully satisfied."", ""score"": 0.5}, {""id"": ""C8"", ""reason"": ""The response is readable, organized, and internally consistent, but it falls short of the requested word-count range and has minor completeness issues in the quiz and misconception depth."", ""score"": 0.5}]","{""academic_identifier_count"": 0, ""criterion_score_caps"": {}, ""deterministic_hard_fail_score_cap"": 1.0, ""markdown_table_count"": 2, ""markdown_table_headers"": [[""Time"", ""Activity"", ""Instructor Action"", ""Learner Action"", ""Learning Objective""], [""Scenario"", ""More Costly Error"", ""Metric to Emphasize"", ""Explanation"", ""Possible Tradeoff""]], ""markdown_table_row_counts"": [9, 2], ""numbered_question_count"": 4, ""reference_entry_count"": 0, ""required_section_presence"": {}, ""selected_paper_count"": 0, ""triggered_hard_fail_rules"": [], ""unresolved_hard_fail_rules"": [], ""word_count"": 955}",23.771,649,1787,2436,100000,0,97564,0,0.0244,0,0,"{""Analyst"": 1300, ""Critic"": 900, ""Manager"": 1300, ""Planner"": 900, ""Researcher"": 1800, ""Single Agent"": 4000, ""Writer"": 4000, ""default"": 1300}","{""Single Agent"": {""input_tokens"": 649, ""interactions"": 1, ""model_calls"": 1, ""output_tokens"": 1787, ""total_tokens"": 2436}}",0.00116955,1,1,1,1,0,0.0,,,Prohibited,[],[],True,True,[],[],0,False,True,True,valid,not_applicable,True,[],0,0,0,0,0,0,0,0,0,0,,0,0.00031712,77.51121279,None,[],deterministic_log_audit,None,[],0.7725,0.0,False,"{""relative_single_agent_drop_threshold"": 0.15, ""source"": ""raw_log""}","[""Failure to satisfy one or more recorded evaluation-rubric requirements."", ""Failure to follow the required output structure or quantitative constraints.""]","{""citation_traceability"": 1.0, ""evidence_cap_reasons"": [], ""evidence_score_cap"": 1.0, ""required_evidence_satisfied"": true, ""source_requirement_findings"": [], ""unsupported_or_unverified_citations"": [], ""used_retrieved_sources"": false}","{""academic_record_count"": 0, ""academic_source_providers"": [], ""allowed_tools"": [], ""call_trace"": [], ""citation_alignment_status"": ""not_applicable"", ""citation_audit"": {""answer_identifiers"": [], ""answer_urls"": [], ""matched_retrieved_titles"": [], ""search_result_only_urls"": [], ""traceability_rate"": null, ""traceable_identifiers"": [], ""traceable_urls"": [], ""unaccessed_identifiers"": [], ""unaccessed_urls"": []}, ""deterministic_cap_reasons"": [], ""deterministic_score_cap"": 1.0, ""discovery_source_count"": 0, ""evidence_policy_satisfied"": true, ""evidence_policy_violations"": [], ""execution_requirement_satisfied"": true, ""execution_status"": ""valid"", ""exposed_tools"": [], ""identifier_record_count"": 0, ""local_document_count"": 0, ""local_document_paths"": [], ""retrieval_dates"": [], ""score_eligible"": true, ""source_records"": [], ""substantive_source_count"": 0, ""substantive_source_domains"": [], ""successful_authorized_tool_call_count"": 0, ""successful_discovery_tool_call_count"": 0, ""successful_substantive_tool_call_count"": 0, ""successful_tool_call_count"": 0, ""tool_call_count"": 0, ""tool_expectation_violations"": [], ""tool_expectations"": {}, ""tool_expectations_satisfied"": true, ""tool_requirement"": ""Prohibited"", ""tool_surface_matches_benchmark"": true, ""unauthorized_tool_call_count"": 0, ""unauthorized_tool_names"": []}","The submission is strong on core metric math and scenario interpretation, but it misses some strict format/completeness constraints reflected in the audit, especially quiz count and length target.",7295,739,8034,stop,0.00879675,0.0099663,benchmark-D,benchmark/benchmark-D.json,[],"{""accuracy_raw"": 4, ""cap_reasons"": [], ""completeness_norm"": 0.75, ""criterion_scores"": [{""id"": ""C1"", ""reason"": ""All 13 required sections are present, and both required tables are included. However, the submission is under the requested 1,000-1,400 word range and the final quiz is not clearly five numbered questions in the audit, reducing coverage quality."", ""score"": 0.5}, {""id"": ""C2"", ""reason"": ""The worked example uses TP=36, FN=9, FP=12, TN=43 and correctly shows precision=0.750, recall=0.800, and F1=0.774 with formulas and three-decimal rounding."", ""score"": 1}, {""id"": ""C3"", ""reason"": ""Precision, recall, F1, and threshold tradeoffs are explained correctly, including the direction of effects when thresholds are lowered or raised."", ""score"": 1}, {""id"": ""C4"", ""reason"": ""The scenario table correctly emphasizes precision and false-positive control for spam filtering, and recall and false-negative control for fraud detection, with tradeoffs stated for both."", ""score"": 1}, {""id"": ""C5"", ""reason"": ""A 75-minute schedule is provided and the progression is logical, but the audit indicates the response is below the target length and the schedule is somewhat generic rather than tightly aligned to observable objectives throughout."", ""score"": 0.5}, {""id"": ""C6"", ""reason"": ""Beginners and more experienced learners are both addressed, but the misconception section contains only four items and the supports are brief rather than especially actionable."", ""score"": 0.5}, {""id"": ""C7"", ""reason"": ""A formative assessment is included, and the quiz covers the requested topic types, but the audit shows only four numbered questions rather than exactly five, so assessment completeness is not fully satisfied."", ""score"": 0.5}, {""id"": ""C8"", ""reason"": ""The response is readable, organized, and internally consistent, but it falls short of the requested word-count range and has minor completeness issues in the quiz and misconception depth."", ""score"": 0.5}], ""detected_failure_risks"": [""Failure to satisfy one or more recorded evaluation-rubric requirements."", ""Failure to follow the required output structure or quantitative constraints.""], ""evidence_assessment"": {""citation_traceability"": 1, ""evidence_cap_reasons"": [], ""evidence_score_cap"": 1, ""required_evidence_satisfied"": true, ""source_requirement_findings"": [], ""unsupported_or_unverified_citations"": [], ""used_retrieved_sources"": false}, ""failure_evidence"": [], ""failure_type"": ""None"", ""hallucination_rate"": 0.05, ""helpfulness_raw"": 4, ""notes"": ""The submission is strong on core metric math and scenario interpretation, but it misses some strict format/completeness constraints reflected in the audit, especially quiz count and length target."", ""overall_score_cap"": 1}"
